{
  "protocol": "IACP",
  "version": "1.0.0",
  "type": "GUIDANCE",
  "from": {
    "hostname": "AIOS",
    "ip": "192.168.1.128",
    "branch": "AIOS-win-0-AIOS"
  },
  "to": {
    "hostname": "ALPHA",
    "ip": "unknown",
    "branch": "AIOS-win-0-ALPHA"
  },
  "timestamp": "2025-12-06T20:16:18.912269Z",
  "status": "PENDING",
  "message_id": "696868d7-c486-49cd-92d9-c9975fafdbf8",
  "actions": [
    {
      "type": "EXECUTE_SCRIPT",
      "description": "START_COMM_SERVER: Execute 'python /workspace/ai/tools/cell_alpha_comm_server.py' to enable dendritic network communication via Traefik. Network path configured: alpha.aios.lan -> aios-cell-alpha:8000. Traefik connected to aios-dendritic-mesh network."
    }
  ],
  "aicp": {
    "intent": "coordinate",
    "trust_level": "enterprise",
    "source_aid": "agent://tecnocrat/aios",
    "target_aid": "agent://tecnocrat/alpha"
  }
}